{
  "operation": "design",
  "brief": "Train and package a new foundation model with custom GPU serving code.",
  "contract": null,
  "identity": {
    "cog_request": 1,
    "name": "cog-action-extractor",
    "id": "openteams/cog-action-extractor",
    "summary": "Extract action items explicitly stated in supplied notes.",
    "owner": "trent@openteams.com",
    "license": "BSD-3-Clause",
    "produces": "action_items",
    "model_cog": {
      "id": "openteams/cog-qwen",
      "source": "../cog-qwen"
    },
    "prohibits": [
      "execute_actions",
      "send_external_message"
    ]
  },
  "materials": [],
  "feedback": []
}
