{
  "operation": "author",
  "brief": "Hand-written code fixture for pipeline integration tests, not live authoring evidence.",
  "contract": {
    "purpose": "Count characters in supplied notes.",
    "user": "Meeting participant",
    "supported_work": [
      "Extract explicit actions with a verbatim supporting quote."
    ],
    "unsupported_work": [
      "Invent owners or actions.",
      "Execute actions."
    ],
    "input_schema": {
      "type": "object",
      "additionalProperties": false,
      "properties": {
        "notes": {
          "type": "string"
        }
      },
      "required": [
        "notes"
      ]
    },
    "output_schema": {
      "type": "object",
      "additionalProperties": false,
      "properties": {
        "length": {
          "type": "integer"
        },
        "authority_use": {
          "type": "array",
          "maxItems": 0
        }
      },
      "required": [
        "length",
        "authority_use"
      ]
    },
    "grounding": "Each quote must occur verbatim in notes.",
    "abstention": "Return abstained true and no actions when no explicit action exists.",
    "model_requirements": "none",
    "locality": "any",
    "prohibits": [
      "execute_actions",
      "send_external_message"
    ],
    "acceptance_criteria": [
      {
        "id": "length",
        "description": "Return the character count of notes without interpreting their contents."
      }
    ],
    "kind": "code"
  },
  "identity": {
    "cog_request": 1,
    "name": "cog-code-fixture",
    "id": "openteams/cog-code-fixture",
    "summary": "Count characters in supplied notes.",
    "owner": "trent@openteams.com",
    "license": "BSD-3-Clause",
    "produces": "action_items",
    "prohibits": [
      "execute_actions",
      "send_external_message"
    ],
    "kind": "code"
  },
  "materials": [],
  "feedback": [],
  "kind": "code"
}
